{
 "schemaVersion": 1,
 "page": 2,
 "timeWindow": "vrijdag tot 20 uur",
 "series": [
  {
   "id": "500",
   "kind": "binnenland",
   "frequency": {
    "class": "1x_per_uur",
    "note": "gecombineerd label 500/600 op gedeeld traject Den Haag-Zwolle (dikke lijn), eigen tak dunne lijn"
   },
   "routes": [
    {
     "stops": [
      "den-haag-centraal",
      "gouda",
      "utrecht-centraal",
      "amersfoort-centraal",
      "zwolle",
      "assen",
      "groningen"
     ],
     "note": ""
    }
   ],
   "exceptions": [],
   "colorHint": "roze",
   "confidence": "high",
   "issues": []
  },
  {
   "id": "600",
   "kind": "binnenland",
   "frequency": {
    "class": "1x_per_uur",
    "note": "gecombineerd label 500/600 op gedeeld traject Den Haag-Zwolle (dikke lijn), eigen tak dunne lijn"
   },
   "routes": [
    {
     "stops": [
      "den-haag-centraal",
      "gouda",
      "utrecht-centraal",
      "amersfoort-centraal",
      "zwolle",
      "meppel",
      "steenwijk",
      "heerenveen",
      "leeuwarden"
     ],
     "note": ""
    }
   ],
   "exceptions": [],
   "colorHint": "roze",
   "confidence": "high",
   "issues": []
  },
  {
   "id": "700",
   "kind": "binnenland",
   "frequency": {
    "class": "1x_per_uur",
    "note": "gecombineerd label 700/800 op gedeeld traject Schiphol-Zwolle"
   },
   "routes": [
    {
     "stops": [
      "schiphol-airport",
      "amsterdam-zuid",
      "almere-centrum",
      "lelystad-centrum",
      "zwolle",
      "assen",
      "groningen"
     ],
     "note": "passeert Dronten en Kampen Zuid (alleen 9000 stopt daar); passeert Meppel"
    }
   ],
   "exceptions": [],
   "colorHint": "lichtblauw",
   "confidence": "high",
   "issues": []
  },
  {
   "id": "800",
   "kind": "binnenland",
   "frequency": {
    "class": "1x_per_uur",
    "note": "gecombineerd label 700/800 op gedeeld traject Schiphol-Zwolle"
   },
   "routes": [
    {
     "stops": [
      "schiphol-airport",
      "amsterdam-zuid",
      "almere-centrum",
      "lelystad-centrum",
      "zwolle",
      "meppel",
      "steenwijk",
      "heerenveen",
      "leeuwarden"
     ],
     "note": ""
    }
   ],
   "exceptions": [],
   "colorHint": "lichtblauw",
   "confidence": "high",
   "issues": []
  },
  {
   "id": "1100",
   "kind": "binnenland",
   "frequency": {
    "class": "2x_per_uur",
    "note": ""
   },
   "routes": [
    {
     "stops": [
      "den-haag-centraal",
      "den-haag-hs",
      "delft",
      "rotterdam-centraal",
      "dordrecht",
      "breda",
      "tilburg",
      "eindhoven-centraal"
     ],
     "note": ""
    }
   ],
   "exceptions": [],
   "colorHint": "goudbruin",
   "confidence": "high",
   "issues": []
  },
  {
   "id": "1500",
   "kind": "binnenland",
   "frequency": {
    "class": "2x_per_uur",
    "note": ""
   },
   "routes": [
    {
     "stops": [
      "amsterdam-centraal",
      "hilversum",
      "amersfoort-centraal",
      "apeldoorn",
      "deventer"
     ],
     "note": "passeert Weesp en Baarn"
    }
   ],
   "exceptions": [],
   "colorHint": "donkerblauw",
   "confidence": "high",
   "issues": []
  },
  {
   "id": "1700",
   "kind": "binnenland",
   "frequency": {
    "class": "2x_per_uur",
    "note": ""
   },
   "routes": [
    {
     "stops": [
      "den-haag-centraal",
      "gouda",
      "utrecht-centraal",
      "amersfoort-centraal",
      "apeldoorn",
      "deventer",
      "almelo",
      "hengelo",
      "enschede"
     ],
     "note": ""
    }
   ],
   "exceptions": [],
   "colorHint": "oranje",
   "confidence": "high",
   "issues": []
  },
  {
   "id": "1800",
   "kind": "binnenland",
   "frequency": {
    "class": "2x_per_uur",
    "note": ""
   },
   "routes": [
    {
     "stops": [
      "breda",
      "rotterdam-centraal",
      "schiphol-airport",
      "amsterdam-zuid",
      "duivendrecht",
      "amersfoort-centraal",
      "amersfoort-schothorst"
     ],
     "note": "via HSL Rotterdam-Schiphol zonder tussenstops; via Weesp/Gooi zonder stops"
    }
   ],
   "exceptions": [],
   "colorHint": "middenblauw",
   "confidence": "medium",
   "issues": [
    "stop Duivendrecht is opvallend voor deze lange lijn maar duidelijk getekend (cirkel op de lijn)",
    "lijn loopt aan de noordzijde langs het Hilversum-ovaal en lijkt Hilversum niet aan te doen; als interpretatie onzeker",
    "eindpunt Amersfoort Schothorst: cirkel op Schothorst, geen cirkel op Vathorst"
   ]
  },
  {
   "id": "2000",
   "kind": "binnenland",
   "frequency": {
    "class": "2x_per_uur",
    "note": ""
   },
   "routes": [
    {
     "stops": [
      "rotterdam-centraal",
      "rotterdam-alexander",
      "gouda",
      "utrecht-centraal"
     ],
     "note": ""
    }
   ],
   "exceptions": [],
   "colorHint": "lila-grijs",
   "confidence": "medium",
   "issues": [
    "alleen Rotterdam Alexander heeft een cirkel; Gouda en eindpunten zijn ovaalstations"
   ]
  },
  {
   "id": "2100",
   "kind": "binnenland",
   "frequency": {
    "class": "2x_per_uur",
    "note": ""
   },
   "routes": [
    {
     "stops": [
      "amsterdam-centraal",
      "amsterdam-sloterdijk",
      "haarlem",
      "heemstede-aerdenhout",
      "leiden-centraal",
      "den-haag-mariahoeve",
      "den-haag-centraal"
     ],
     "note": ""
    }
   ],
   "exceptions": [],
   "colorHint": "rood",
   "confidence": "high",
   "issues": []
  },
  {
   "id": "2200",
   "kind": "binnenland",
   "frequency": {
    "class": "2x_per_uur",
    "note": "gecombineerd label 2200/2300; Roosendaal-Vlissingen dunne lijn (1x per uur per serie)"
   },
   "routes": [
    {
     "stops": [
      "amsterdam-centraal",
      "amsterdam-sloterdijk",
      "haarlem",
      "heemstede-aerdenhout",
      "leiden-centraal",
      "den-haag-laan-van-noi",
      "den-haag-hs",
      "delft",
      "rotterdam-centraal",
      "rotterdam-blaak",
      "dordrecht",
      "roosendaal",
      "bergen-op-zoom",
      "kapelle-biezelinge",
      "goes",
      "arnemuiden",
      "middelburg",
      "vlissingen-souburg",
      "vlissingen"
     ],
     "note": "in Zeeland stopt 2200 wel te Arnemuiden en Kapelle-Biezelinge, niet te Kruiningen-Yerseke, Krabbendijke en Rilland-Bath"
    }
   ],
   "exceptions": [],
   "colorHint": "oudroze",
   "confidence": "high",
   "issues": []
  },
  {
   "id": "2300",
   "kind": "binnenland",
   "frequency": {
    "class": "2x_per_uur",
    "note": "gecombineerd label 2200/2300; Roosendaal-Vlissingen dunne lijn (1x per uur per serie)"
   },
   "routes": [
    {
     "stops": [
      "amsterdam-centraal",
      "amsterdam-sloterdijk",
      "haarlem",
      "heemstede-aerdenhout",
      "leiden-centraal",
      "den-haag-laan-van-noi",
      "den-haag-hs",
      "delft",
      "rotterdam-centraal",
      "rotterdam-blaak",
      "dordrecht",
      "roosendaal",
      "bergen-op-zoom",
      "rilland-bath",
      "krabbendijke",
      "kruiningen-yerseke",
      "goes",
      "middelburg",
      "vlissingen-souburg",
      "vlissingen"
     ],
     "note": "in Zeeland stopt 2300 wel te Rilland-Bath, Krabbendijke en Kruiningen-Yerseke, niet te Arnemuiden en Kapelle-Biezelinge"
    }
   ],
   "exceptions": [],
   "colorHint": "oudroze",
   "confidence": "high",
   "issues": []
  },
  {
   "id": "2400",
   "kind": "binnenland",
   "frequency": {
    "class": "2x_per_uur",
    "note": "getekend als gecombineerde lijn met label 2400/9500 tussen Rotterdam en Lelystad"
   },
   "routes": [
    {
     "stops": [
      "rotterdam-centraal",
      "schiphol-airport",
      "amsterdam-zuid",
      "almere-centrum",
      "almere-buiten",
      "lelystad-centrum"
     ],
     "note": "via HSL, passeert Leiden en Den Haag niet"
    }
   ],
   "exceptions": [],
   "colorHint": "blauwpaars",
   "confidence": "medium",
   "issues": [
    "2400 en 9500 zijn op het NL-traject als een lijn getekend; stops per afzonderlijke serie niet te onderscheiden"
   ]
  },
  {
   "id": "2500",
   "kind": "internationaal",
   "frequency": {
    "class": "1x_per_uur",
    "note": ""
   },
   "routes": [
    {
     "stops": [
      "roosendaal",
      "essen",
      "wildert",
      "kalmthout",
      "kijkuit",
      "heide",
      "kapellen",
      "sint-mariaburg",
      "ekeren",
      "antwerpen-noorderdokken",
      "antwerpen-luchtbal",
      "antwerpen-centraal",
      "antwerpen-berchem",
      "antwerpen-zuid",
      "hoboken-polder",
      "hemiksem",
      "schelle",
      "niel",
      "boom",
      "ruisbroek-sauvegarde",
      "puurs"
     ],
     "note": ""
    }
   ],
   "exceptions": [],
   "colorHint": "oranje",
   "confidence": "high",
   "issues": []
  },
  {
   "id": "2600",
   "kind": "binnenland",
   "frequency": {
    "class": "2x_per_uur",
    "note": ""
   },
   "routes": [
    {
     "stops": [
      "amsterdam-centraal",
      "almere-centrum"
     ],
     "note": "zonder tussenstops getekend"
    }
   ],
   "exceptions": [],
   "colorHint": "grijsblauw",
   "confidence": "medium",
   "issues": [
    "korte lijn zonder tussenliggende cirkels; begin- en eindpunt zijn ovaalstations"
   ]
  },
  {
   "id": "2700",
   "kind": "binnenland",
   "frequency": {
    "class": "2x_per_uur",
    "note": ""
   },
   "routes": [
    {
     "stops": [
      "den-helder",
      "den-helder-zuid",
      "anna-paulowna",
      "schagen",
      "heerhugowaard",
      "alkmaar-noord",
      "alkmaar",
      "castricum",
      "zaandam",
      "amsterdam-sloterdijk",
      "amsterdam-centraal",
      "amsterdam-amstel",
      "utrecht-centraal",
      "s-hertogenbosch",
      "eindhoven-centraal",
      "weert",
      "roermond",
      "sittard",
      "maastricht"
     ],
     "note": "passeert Heiloo en Uitgeest; Amsterdam-Utrecht zonder tussenstops"
    }
   ],
   "exceptions": [
    {
     "type": "other",
     "note": "traject Den Helder-Alkmaar gestreept (spitsstijl) met pijlen: ochtendspits richting Alkmaar/Amsterdam, middagspits richting Den Helder"
    },
    {
     "type": "other",